{
  "specversion": "1.0",
  "id": "evt_ai_example_001",
  "type": "ai.output.approved",
  "source": "template-project",
  "time": "2026-08-17T10:05:00Z",
  "subject": "template-project:example:generate",
  "datacontenttype": "application/json",
  "data": {
    "event_version": 1,
    "project_slug": "template-project",
    "environment": "staging",
    "release": "2026.08.17.1",
    "capability_id": "template-project:example:generate",
    "use_case_id": "template-project.example-draft",
    "profile": "assistive_generation",
    "provider": "approved-router",
    "underlying_provider": "approved-model-provider",
    "model_id": "provider/pinned-model-version",
    "prompt_version": "example-draft-v1",
    "outcome": "approved",
    "review_status": "approved",
    "invocation_channel": "web",
    "actor_type": "human",
    "actor_id": "psn_7e64a47d",
    "correlation_id": "corr_ai_event_001",
    "trace_id": "4bf92f3577b34da6a3ce929d0e0e4736",
    "duration_ms": null,
    "input_tokens": null,
    "output_tokens": null,
    "cost": null,
    "currency": null,
    "reason_code": null,
    "evaluation_flags": []
  }
}
